{
"schema":"catalyst.evo-project-analysis.v1",
"schema_version":1,
"baseline_fingerprint":"fnv1a64-v1:9cd2e123c46c562d",
"analysis_fingerprint":"fnv1a64-v1:2cc6038835197dba",
"provider":{"identity":"clang-llvm-test-provider-v1","clang":"clang-18.1.8","llvm":"llvm-18.1.8","target":"portable-posix-c17","flags":"fixture-c17-flags-v1"},
"runtime_profile":{"state":"available","identity":"fixture-sample-profile-v1"},
"translation_units":["src/value.c","tests/value_test.c"],
"source_locations":[{"identity":"loc:header:declaration","file":"include/value.h","line":4,"column":1,"end_line":4,"end_column":29,"kind":"spelling","spelling_identity":null},{"identity":"loc:header:guard","file":"include/value.h","line":1,"column":1,"end_line":1,"end_column":37,"kind":"spelling","spelling_identity":null},{"identity":"loc:source:function","file":"src/value.c","line":3,"column":1,"end_line":6,"end_column":2,"kind":"spelling","spelling_identity":null},{"identity":"loc:source:macro-expansion","file":"src/value.c","line":1,"column":1,"end_line":1,"end_column":18,"kind":"macro-expansion","spelling_identity":"loc:header:guard"},{"identity":"loc:source:return","file":"src/value.c","line":5,"column":5,"end_line":5,"end_column":28,"kind":"spelling","spelling_identity":null},{"identity":"loc:test:call","file":"tests/value_test.c","line":5,"column":12,"end_line":5,"end_column":28,"kind":"spelling","spelling_identity":null},{"identity":"loc:test:main","file":"tests/value_test.c","line":3,"column":1,"end_line":6,"end_column":2,"kind":"spelling","spelling_identity":null}],
"declarations":[{"identity":"decl:fixture-value:def","name":"fixture_value","translation_unit":"src/value.c","location_identity":"loc:source:function","kind":"function","linkage":"external","definition":true},{"identity":"decl:fixture-value:header","name":"fixture_value","translation_unit":"src/value.c","location_identity":"loc:header:declaration","kind":"function","linkage":"external","definition":false},{"identity":"decl:input:param","name":"input","translation_unit":"src/value.c","location_identity":"loc:source:function","kind":"variable","linkage":"none","definition":true},{"identity":"decl:main:def","name":"main","translation_unit":"tests/value_test.c","location_identity":"loc:test:main","kind":"function","linkage":"external","definition":true}],
"calls":[{"identity":"call:main:fixture-value","caller":"decl:main:def","callee":"decl:fixture-value:def","location_identity":"loc:test:call","kind":"direct"}],
"control_flows":[{"identity":"cfg:fixture-value:entry-return","function":"decl:fixture-value:def","from":"block:entry","to":"block:return","location_identity":"loc:source:function","kind":"fallthrough"},{"identity":"cfg:fixture-value:return-exit","function":"decl:fixture-value:def","from":"block:return","to":"block:exit","location_identity":"loc:source:return","kind":"return"}],
"data_flows":[{"identity":"df:fixture-value:input-read","function":"decl:fixture-value:def","declaration":"decl:input:param","location_identity":"loc:source:return","kind":"read"}],
"compiler_optimizations":[{"identity":"opt:inline:main-call","pass":"inline","function":"decl:main:def","location_identity":"loc:test:call","message":"callee was not inlined","disposition":"missed"},{"identity":"opt:reassociate:return","pass":"reassociate","function":"decl:fixture-value:def","location_identity":"loc:source:return","message":"integer expression retained","disposition":"missed"}],
"runtime_hotspots":[{"identity":"runtime:fixture-value:return","workload":"small-value-loop-v1","function":"decl:fixture-value:def","location_identity":"loc:source:return","metric":"sample-count","value":100},{"identity":"runtime:main:call","workload":"small-value-loop-v1","function":"decl:main:def","location_identity":"loc:test:call","metric":"sample-count","value":900}],
"opportunities":[{"rank":1,"kind":"compiler-missed-and-runtime-hotspot","location_identity":"loc:test:call","missed_optimization_count":1,"runtime_sample_count":900},{"rank":2,"kind":"compiler-missed-and-runtime-hotspot","location_identity":"loc:source:return","missed_optimization_count":1,"runtime_sample_count":100}],
"human_readable_abstraction":{"reference_form":"complete-ordered-record-arrays-and-direct-scans","projection":"analysis.md","complete":true,"probabilistic_authority":false},
"source_modified":false,"evolutionary_operator_invoked":false
}
